{
  "resId": "a3d9b7e0-aaaa-4bbb-8ccc-1234567890ab",
  "name": "Climate dataset DIP order",
  "query": "resId:6f1e8c2a-1234-4abc-9def-0123456789ab",
  "queryType": "DIRECT",
  "metadataVersion": "5.0",
  "publicOrder": true,
  "status": "READY",
  "creation": {
    "who": "u12345",
    "fullName": "Jane Researcher",
    "when": "2026-06-03T09:30:00Z"
  }
}